{
  "version": "1.0.0-indoor",
  "level": "indoor",
  "altitude": {
    "min_height": 20,
    "max_height": 200,
    "takeoff_height": 50
  },
  "velocity": {
    "max_horizontal": 40,
    "max_vertical": 30,
    "max_yaw": 50
  },
  "battery": {
    "warning_threshold": 30,
    "critical_threshold": 20,
    "emergency_threshold": 15,
    "enable_auto_land": true,
    "low_battery_action": "land"
  },
  "sensors": {
    "min_tof_distance": 50,
    "max_tilt_angle": 15,
    "max_acceleration": 1.5,
    "baro_pressure_delta": 3.0,
    "sensor_failure_action": "land"
  },
  "emergency": {
    "connection_timeout": 3000,
    "sensor_failure_action": "land",
    "enable_auto_land": true,
    "low_battery_action": "land"
  },
  "behavioral": {
    "enable_flips": false,
    "min_flip_height": 100,
    "max_flight_time": 300,
    "max_command_rate": 5
  }
}